{
  "$schema": "http://json-schema.org/draft-07/schema#",
  "title": "Ticket",
  "type": "object",
  "required": ["id", "created_at", "first_response_at", "escalated", "escalated_at"],
  "additionalProperties": false,
  "properties": {
    "id": {
      "type": "string",
      "description": "Unique ticket identifier."
    },
    "created_at": {
      "type": "string",
      "format": "date-time",
      "description": "ISO 8601 UTC timestamp when the ticket was created. Start of the SLA clock."
    },
    "first_response_at": {
      "type": ["string", "null"],
      "format": "date-time",
      "description": "ISO 8601 UTC timestamp of the first agent response, or null if none has been sent yet."
    },
    "escalated": {
      "type": "boolean",
      "description": "True once this ticket has been escalated for missing the first-response SLA."
    },
    "escalated_at": {
      "type": ["string", "null"],
      "format": "date-time",
      "description": "ISO 8601 UTC timestamp when escalation happened, or null if not escalated."
    }
  }
}
