[
  {
    "id": "T-1001",
    "created_at": "2026-08-17T12:00:00Z",
    "first_response_at": null,
    "escalated": false,
    "escalated_at": null
  },
  {
    "id": "T-1002",
    "created_at": "2026-08-20T12:00:00Z",
    "first_response_at": "2026-08-21T10:00:00Z",
    "escalated": false,
    "escalated_at": null
  },
  {
    "id": "T-1003",
    "created_at": "2026-08-19T12:00:00Z",
    "first_response_at": null,
    "escalated": false,
    "escalated_at": null
  },
  {
    "id": "T-1004",
    "created_at": "2026-08-15T12:00:00Z",
    "first_response_at": null,
    "escalated": true,
    "escalated_at": "2026-08-20T12:00:00Z"
  }
]
